4,There's a process we need to go through: Langer on Smith becoming Aus captain again,"On Matthew Wade being appointed Australia's stand-in captain in Aaron Finch's absence, coach Justin Langer said that the team would go through a ""process"" before Steve Smith is named captain. Smith's 24-month captaincy ban over the sandpaper scandal ended in March this year. ""Smith doing all the right things to show leadership without a title at the moment,"" Langer added."
0,Entertainment will be critical when cars drive themselves: Elon Musk,"Tesla CEO Elon Musk, while discussing in-car gaming in autonomous vehicles, tweeted, ""Entertainment will be critical when cars drive themselves."" Tesla recently released an update that featured three new in-car video games. Musk said an online multiplayer version of one of the games will be added and asked people what Tesla should do with in-car gaming in an autonomous world."
0,Tesla to start delivering its China-made Model Y SUVs this month,"Tesla has started selling China-made Model Y SUV and will deliver them to customers this month. The starting price of a Model Y in China is now $52,028.16, according to its China website. Tesla recently launched its largest Supercharger station in China. The new station has 72 stalls of Tesla's V2 Supercharger, which can output 150 kW."
6,US House passes legislation to promote Mahatma Gandhi's legacy,"The US House of Representatives has passed a legislation to establish an exchange initiative with India to study the legacies of Mahatma Gandhi and Martin Luther King Jr. The Gandhi-King Scholarly Exchange Initiative Act was written by US Congressman John Lewis, who died in July. ""This legislation honours the long standing relationship between the US and...India,"" Congressman Eliot Engel said."
6,"60,000 koalas were killed or harmed in Australian bushfires: WWF","More than 60,000 koalas were killed, injured or displaced in Australian bushfires last summer, the World Wide Fund for Nature (WWF) has estimated. ""That is a devastating number for a species that was already sliding towards extinction in Eastern Australia. We cannot afford to lose koalas on our watch,"" the WWF said."
2,Nobody is above law: Maharashtra minister after son-in-law's arrest by NCB,"A day after the Narcotics Control Bureau (NCB) arrested his son-in-law in a drug case, Maharashtra Cabinet Minister Nawab Malik said nobody is above the law and the law should be applied without any discrimination. Without mentioning the arrest, Malik tweeted, ""Law will take its due course and justice will prevail. I respect and have immense faith in our judiciary."""
6,US says al-Qaeda has a 'new home base' in Iran,"US Secretary of State Mike Pompeo on Tuesday said that al-Qaeda has established a ""new home base"" in Iran. Pompeo cited the killing of Abu Muhammad al-Masri, al-Qaeda's second-in-command, in Iran in August last year as an example of the terror organisation's presence in the country. Iranian Foreign Minister Javad Zarif called Pompeo's claims ""warmongering lies""."
5,AI models to predict future of COVID-19 patients' condition made: Facebook,"Facebook and NYU claim to have developed three machine learning models to help doctors predict how COVID-19 patients' condition may develop. Facebook said the model using sequential chest X-rays can predict up to ""four days"" in advance if a patient may need more intensive care solutions. The predictions could help doctors avoid sending at-risk patients home too soon, Facebook added."
6,Be vigilant: France to its citizens around the world after attacks,"French Foreign Minister Jean-Yves Le Drian on Friday asked French citizens around the world to be vigilant as ""there are threats everywhere"". He added that the government has instructed its embassies around the world to tighten security in the wake of recent attacks in Nice and Paris. Meanwhile, French President Emmanuel Macron held a crisis meeting with top ministers."
4,"Afridi gets angry at 21-yr-old Afghan pacer over fight with Amir, video goes viral","Galle Gladiators captain Shahid Afridi got angry at Kandy Tuskers' 21-year-old Afghan pacer Naveen-ul-Haq after the latter had a verbal spat with Mohammad Amir. While greeting the Afghan's team after their LPL match, Afridi was seen staring at Naveen-ul-Haq and angrily asking, ""Kya hua?"" Afridi later tweeted, ""My advice to...[him]...was simple, play the game and don't indulge in abusive talk."""
3,Cancer drug outperforms remdesivir against COVID-19 virus: Study,"Researchers said pralatrexate, a drug originally developed to treat lymphoma, has outperformed remdesivir drug against SARS-CoV-2 in lab settings. Haiping Zhang of the Shenzhen Institutes of Advanced Technology and others screened 1,906 existing drugs for their potential ability to inhibit replication of SARS-CoV-2. Pralatrexate and azithromycin successfully inhibited replication of the virus."
2,Pappu Yadav falls after stage collapses during rally in Bihar; video surfaces,"Jan Adhikar Party leader Pappu Yadav fell down after the stage collapsed during his rally in Bihar's Muzaffarpur ahead of the voting in Phase 2 of the state Assembly elections. A video of the incident has also surfaced on social media, wherein his supporters could be seen helping him get up. Some people could be seen recording the incident."
2,CAQM doesn't have office space for Chairperson or staff: AAP,"The AAP on Thursday said that the Commission for Air Quality Management (CAQM) set up by the Centre to monitor Delhi's pollution situation neither has an office space for the Chairperson nor the staff. ""I want to request the Central government that you should immediately provide office space to the air quality commission...to run day-to-day works,"" AAP spokesperson Atishi said."
0,Car designer Dilip Chhabria of DC Design arrested in case of alleged cheating,"Renowned car designer Dilip Chhabria has been arrested in connection with an alleged cheating and forgery case, Mumbai Police said on Monday. Chhabria is the Founder of Indian design firm DC Design that makes concept cars and custom special order vehicles. One of his cars was also seized and Crime Branch said that there were more accused in the case."
3,153-yr-old Patna Met Centre gets centennial observing station status,"The WMO has awarded the status of 'centennial observing station' to the Patna meteorological observatory. ""With this recognition, Patna has joined a niche club of cities having a long-term record of scientific observation in the field of meteorology, climatology and applied science,"" Centre's Director Vivek Sinha said. Patna meteorological observatory was established in 1867."
1,'Motichoor Chaknachoor' has scarred my daughter Athiya: Suniel,"Suniel Shetty recently opened up about his daughter Athiya's 2019 film 'Motichoor Chaknachoor', which was caught up in controversies. He said, ""Motichoor Chaknachoor has scarred her so much. She's so scared now that anything which comes from me she wants to think about it 25 times."" Last year, the producers sent a notice to Suniel for interfering with the film."
4,"Wriddhiman Saha back at the nets, BCCI shares batting video","Team India wicket-keeper batsman Wriddhiman Saha, who is recovering from a hamstring injury, was seen batting in the nets in a video uploaded on Twitter by BCCI. In the video, Saha was seen hitting the ball right out of the middle of the bat while taking throwdowns. Playing for SRH, Saha had injured himself in the recently-concluded IPL 2020."
3,Russian cosmonauts to receive Sputnik V COVID-19 vaccine,"Russian space agency Roscosmos has said that Russian cosmonauts ""will be among the first to be vaccinated"" against COVID-19 with the Sputnik V vaccine but insisted that it will be done on a voluntary basis only. The vaccine will play an important role in ensuring the safety of Russia's space program, Minister of Health of the Russian Federation said."
6,Islamabad extends ban on protests amid opposition rallies in Pak,"Islamabad on Friday extended the ban on protests and all kinds of gatherings of five or more people for two months. This comes amid anti-government protests by the 11-party opposition alliance, Pakistan Democratic Movement (PDM). Authorities said the ban was extended knowing that certain segments of society are planning to organise unlawful assemblies that can disrupt peace and tranquillity."
5,Addressing cybersecurity important for financial inclusion: RBI Guv,"RBI Governor Shaktikanta Das on Wednesday said that addressing the issues of cybersecurity and data protection is important for gaining confidence of the excluded section, which is necessary for promoting financial inclusion. He added that financial inclusion in India is poised to grow ""exponentially"" as millennials are joining the workforce and social media is blurring the urban-rural divide."
6,Ex-Pak PM Nawaz Sharif declared 'proclaimed offender' by High Court,"Pakistan's former Prime Minister Nawaz Sharif on Wednesday was declared a ""proclaimed offender"" by the Islamabad High Court. Sharif had failed to appear before the court despite repeated summons in connection with two corruption cases. Sharif has been in London since November last year after he was granted permission to go abroad for four weeks for medical treatment."
3,Indian student among winners of NASA app development challenge: Report,"A high school student from Gurugram, Aryan Jain, is among the winners of NASA's Artemis Next Gen STEM-Moon to Mars App Development Challenge, PTI reported. Jain had teamed up with six high school students from the US. The competition was a coding challenge in which NASA presented technical problems to students and sought their contributions to deep space exploration missions."
1,"Bollywood lacks spine, should stand with their community: Vijender on farmers' protest","Amid the ongoing farmers' protests against the recently passed agricultural bills by the government, boxer Vijender Singh has criticised Bollywood for not supporting the farmers. ""When the oil prices were hitting the roof back in 2014, celebrities like Amitabh Bachchan and Akshay Kumar, were extremely critical of the then government...and now...they are nowhere to be found,"" he said."
6,South Korean military detains North Korean man crossing border,"South Korea's military on Wednesday detained a North Korean man after he crossed the heavily fortified inter-Korean border. The incident has led to an urgent search operation. ""An investigation is planned to find out details about the man, including how he had come down and whether he wished to defect,"" South Korea's Joint Chiefs of Staff said in a statement."
2,"Stop threatening, show governance instead: Fadnavis to Maharashtra CM","Former Maharashtra CM Devendra Fadnavis has asked current CM Uddhav Thackeray to stop 'threatening' opposition and ""show governance instead"". This comes after CM told opposition leaders to not force him to 'go after them' by playing vindictive politics. Criticising state government over COVID-19 situation, Fadnavis said, ""It's by God's grace that second wave hasn't reached Maharashtra yet."""
4,Latest ICC rankings for Test batsmen out; Kohli and Smith swap spots,"The ICC today released the latest rankings for Test batsmen following the India-Australia Sydney Test. Australia batsman Steve Smith jumped one spot to be ranked second, while Team India captain Virat Kohli dropped a spot to be ranked third. Meanwhile, India batsman Cheteshwar Pujara jumped two places and is now ranked eighth, while stand-in captain Ajinkya Rahane is seventh."
0,Tesla's success should justify its share price: Raghuram Rajan,Economist and former Reserve Bank of India (RBI) Governor Raghuram Rajan said Tesla's success and spread of vehicles must be viewed firmly and should justify its rising stock price. He added that Tesla is a case of a stock that's being priced at many multiples of the price of automakers such as Toyota or General Motors.
1,Varun Dhawan to shoot a song with Salman Khan for 'Antim': Reports,"Actor Varun Dhawan will reportedly film a special song with Salman Khan for his upcoming film 'Antim: The Final Truth', which also stars Aayush Sharma. Reportedly, the song will be a ""Ganpati dance number"". Directed by actor-filmmaker Mahesh Manjrekar, the movie will feature Salman as a Sikh cop and Aayush will play the role of a gangster."
3,Indian spacetech startup Agnikul builds 3D printed rocket engine,"Chennai-based spacetech startup Agnikul Cosmos has developed a single piece, fully 3D printed rocket engine called Agnilet, which can be directly used in a rocket. The engine will be used in the second stage of Agnikul's launch vehicle Agnibaan, CEO and Co-founder Srinath Ravichandran said. Launched in 2017, the startup is involved in building India's private small satellite launch vehicle."
0,"Honda recalls 737,000 Accord, Insight cars in US over software flaw","Honda is recalling 737,000 Accord gas and hybrid cars from 2018 to 2020 and Insight hybrid cars from 2019 to 2020 after discovering a glitch in its software. The programming flaw in its control computer can cause the rear camera, turn signals and windshield wipers to malfunction. The move comes as part of a larger recall of 1.79-million cars worldwide."
0,Tata Motors' shares rise 11% amid reports of tie-up with Tesla,"Tata Motors' shares surged further 11% on Tuesday amid reports of it partnering with Tesla in India. On Monday, its shares had climbed 13%. Its shares also rose as it posted a 13.1% increase in the number of sales of Jaguar Land Rover (JLR) vehicles in the December quarter. The company added that China sales for JLR were ""particularly encouraging""."
1,It is hard: Liam Payne on co-parenting his child amid COVID-19,"During a recent Instagram Live, singer Liam Payne revealed that it has been complicated to co-parent his son Bear Grey, with his ex-partner Cheryl Cole, amid the ongoing coronavirus pandemic. ""It's hard...I have to make sure I'm negative before I go over and see him. So, it's having to wait that couple of days before you can test,"" Liam explained."
6,Egypt reopens its airspace to Qatar after over 3 years,"Egypt has reopened its airspace to Qatar over three years after it imposed an embargo on the Gulf nation, the Egyptian Aviation Ministry said. Egypt, along with Saudi Arabia, the UAE and Bahrain had imposed the embargo in 2017. In a breakthrough, the three Gulf states signed an agreement to end their dispute with Qatar last week."
0,Tesla signs five-year deal with Chinese company for lithium supply,"China's Sichuan Yahua Industrial Group has signed a five-year deal with Tesla to supply battery-grade lithium hydroxide to the EV manufacturer. The total value of the contract was put at $630-880 million over 2021-25 in a filing to the Shenzhen Stock Exchange, Reuters reported. Ganfeng Lithium, one of the world's largest lithium producers, also supplies the commodity to Tesla."
4,I let the bowlers down: Tim Paine on 3 dropped catches on Day 5 vs India,"Australia Test captain Tim Paine has said that he let the bowlers down on the final day of the Sydney Test as he dropped three catches. ""I am bitterly disappointed, I pride myself on my wicketkeeping. Haven't had too many worse days than today,"" said Paine, who dropped Rishabh Pant twice in his 97-run innings. Later, he dropped Hanuma Vihari."
4,"If Hardik is unfit, where is 6th bowling option: Gambhir","After India suffered defeat to Australia in the first ODI, former India opener Gautam Gambhir asked, ""If Hardik Pandya is not fit [to bowl], where is the sixth bowling option."" ""It's only Vijay Shankar that I can think of but does he have the same impact batting at number five or six...I have my doubts,"" he added."
1,"I was told 'You would never be a heroine, you don't look like Deepika': Fatima","Actress Fatima Sana Shaikh recently opened up about facing rejections in the film industry. She said, ""I was told, 'You would never be a heroine. You don't look like Deepika, you don't look like Aishwarya'."" Fatima added, ""But there are opportunities now, there are films being made for people like me, who don't look like supermodels, who look normal, average."""
1,"UP Police reaches 'Tandav' maker's house to serve him notice, pics surface",The Uttar Pradesh Police on Thursday reached 'Tandav' director Ali Abbas Zafar's Mumbai residence to hand him a legal notice. Ali was reportedly in Dehradun with his family when the police entered his residential building in Andheri. A four-member team from Lucknow's Hazratganj police station had arrived in Mumbai on Wednesday to probe the case lodged against the series makers.
1,Kapil Sharma runs for 30 mins straight at 16 kph: Trainer on his weight loss,"Kapil Sharma's fitness trainer Yogesh Bhateja, speaking about the comedian's weight loss journey, revealed, ""We started in May...Kapil Sharma had a spinal injury a couple of years ago...I helped him strengthen his glutes."" ""We had to work on his functionality in...safer manner,"" Bhateja added. ""Now he can do anything...Kapil runs for 30 minutes straight at 16 kph,"" he stated."
3,Five genes linked to most severe form of COVID-19 found,"Scientists in the UK have identified five genes that are linked with the most severe form of COVID-19. The genes partially explain why some people become extremely sick with COVID-19, while others are not affected, according to their study. ""Our results immediately highlight which drugs should be at the top of the list for clinical testing,"" a scientist said."
5,Dogecoin surges 25% after Elon Musk tweets about it,"Dogecoin, a meme-inspired cryptocurrency, increased by about 25% in value after Elon Musk, the second richest man in the world tweeted about it. ""One word: Doge"" was his tweet, which was followed by Musk changing his Twitter bio to ""Former CEO of Dogecoin"" as a joke. Musk tweeted about Dogecoin in July too, which sent its value up 14% then."
3,IIT-B researchers create AI model to identify malaria parasites,"Researchers from IIT-Bombay have created an AI-based model using proteomics technology that can help differentiate between two major species of malaria parasites, P falciparum and P vivax. These species are not differentiable using the rapid diagnostic tests (RDT), Shalini Aggarwal, who was part of the study, said. The researchers are currently working on developing a diagnostic kit prototype."
4,"Gayle throws his bat in frustration after getting out on 99, video surfaces","KXIP batsman Chris Gayle threw away his bat in frustration after getting out on 99 against RR on Friday. This is the first time in his T20 career that he got out on 99. ""To the guys who I promised a century today, I missed out but in my mind it's a century. I scored a hundred,"" he later said."
2,"US Transportation, Education secretaries quit after Capitol violence","US Transportation Secretary Elaine Chao and Education Secretary Betsy DeVos resigned on Thursday following riots at the US Capitol by President Donald Trump's supporters. Chao said that the mob attack ""has deeply troubled me in a way that I simply cannot set aside"", adding that her resignation will take effect on Monday. Meanwhile, DeVos said the attack was unconscionable."
0,Own a car without buying it : Revv Subscriptions,"You can now drive a new car every month as Revv provides the option to subscribe to your favourite car for 1-36 months with ₹0 down payment, ₹0 road tax and without the hassle of maintenance and service. The car will be sanitized and delivered to your doorstep ensuring complete safety for you and your loved ones."
1,Father's pot of gold can't make you a star: Vikram on nepotism,"Commenting on Bollywood's nepotism debate, filmmaker Vikram Bhatt said, ""Nothing can make you a star except for the audience...no amount of father's pot of gold can make you a star."" Stating that he is sick and tired of the debate, Vikram told Times Now, ""If you're talented, you will make it...if you're not, for God's sake, stop blaming nepotism."""
6,US says al-Qaeda has a 'new home base' in Iran,"US Secretary of State Mike Pompeo on Tuesday said that al-Qaeda has established a ""new home base"" in Iran. Pompeo cited the killing of Abu Muhammad al-Masri, al-Qaeda's second-in-command, in Iran in August last year as an example of the terror organisation's presence in the country. Iranian Foreign Minister Javad Zarif called Pompeo's claims ""warmongering lies""."
1,Letitia deletes social media accounts amid anti-vaccine video criticism,"'Black Panther' actress Letitia Wright deleted her social media accounts following the criticism she received after posting a video that questioned the legitimacy of the coronavirus vaccine. She recently tweeted the link of a video, titled 'COVID-19 VACCINE, SHOULD WE TAKE IT?', for which she faced criticism. ''If you...ask questions...you get cancelled, '' she had reacted to the backlash."
1,Cinemas will be there but digital platforms have wide reach: Rajkummar,"Actor Rajkummar Rao, whose film 'Chhalaang' was recently released on a digital platform instead of movie theatres, said, ""Cinemas will always be there but OTT also has a very wide reach."" Commenting on the cinema vs OTT debate, the actor said, ""OTT is definitely a very powerful platform...Cinema is a community viewing experience and OTT is a very personal experience."""
1,"If I were a struggler, I would have been married by now: Shehnaaz","When asked about her marriage plans during a recent Instagram live, Bigg Boss 13 contestant Shehnaaz Gill said, ""I don't think I'm at the age where I should get married."" She added, ""If I [were] a struggler, I would definitely have been married. I would have had kids also by now. But right now, it's time...to work hard."""
5,Twitter unfreezes New York Post account after banning for Biden story,"Twitter said it has lifted a freeze it placed on New York Post's account after it published articles on Democratic presidential candidate Joe Biden's son Hunter. Twitter had said the stories violated its hacked materials policy and that it has now changed its policies. News Corp, New York Post's parent, said the moment was important for freedom of press."
2,Fake farmers eating pizza & KFC products: BJP MP on protesters at Delhi borders,"BJP MP from Kolar in Karnataka, S Muniswamy, on Monday said that the farmers who are protesting against the Centre's farm laws at Delhi borders have been paid and brought there. He called the protesters ""middlemen"" and ""fake farmers"". He added, ""They are eating pizza, burger and KFC products, and have also set up gym there. This drama should stop."""
1,Mom told me to be honest: Renee on getting acting advice from Sushmita,"Renee Sen, who will make her acting debut with the upcoming short film 'Suttabaazi', spoke about receiving acting advice from her mother, actress Sushmita Sen, and said, ""My mom just told me to be very honest about it."" She added, ""Her only advice to me...is that I should be able to deliver what my director wants me to."""
5,London gallery allows guests to view art show through robots,"The Saatchi Gallery in London is holding a private viewing of Philip Colbert's ""Lobsteropolis"" for people via remote-controlled telepresence robots on wheels. The robots navigate through the gallery, allowing guests to view Colbert's works on the cartoon lobster through cameras and a tablet. Colbert said that he wanted to stage the exhibition like ""a sci-fi vision of a possible future""."
6,Russia approves use of Sputnik V vaccine for people above 60: Reports,"Russia has approved the use of Sputnik V COVID-19 vaccine for people over the age of 60, Russian news agencies reported. People over 60 were excluded from Russia's national inoculation programme, as the vaccine was being tested on this age group separately. Earlier, Russian President Vladimir Putin said he would take the vaccine when it becomes ""possible for his age""."
6,There's going to be a whole lot of pain: Fauci warns of COVID-19 spread in US,"Top US infectious diseases expert Dr Anthony Fauci has warned of ""unrelenting"" spread of coronavirus in the US, adding that the country is ""going in the wrong direction"". ""If things don't change...there’s going to be a whole lot of pain in this country with regard to additional cases and hospitalisations, and deaths,"" he warned."
0,Fiat Chrysler to invest $250 million in India unit,"Fiat Chrysler Automobiles (FCA) has said it will invest $250 million in India to launch four new sport-utility vehicles (SUVs) over the next two years, taking its total investment in the country to over $700 million. The company will produce and assemble the new SUVs at its car plant in Maharashtra, which it jointly owns with Tata Motors."
1,I've the highest regard for those who supported Rhea: Rumi Jaffery,"Filmmaker Rumi Jaffery has said Rhea Chakraborty should get a fair trial in Sushant Singh Rajput's death case. ""People drew their own conclusions on the matter. Ideally, we should wait for...judiciary [to give its verdict],"" he added. ""Every coin has two sides, but Rhea should also get a fair trial...I've the highest regard for those who supported her,"" Rumi said."
5,Need to classify social media platforms as news media: SC Judge,"Supreme Court Judge S Ravindra Bhat said there is a need to classify social media platforms as news media and subject them to same journalistic standards. He added the platforms can never be neutral. He even said the news disseminated on these platforms is not factual and fake news and planting bots have ""triggered riots that leads to public mischief""."
