1,Salman to shoot a cameo for Aamir's 'Laal Singh Chaddha': Reports,"Salman Khan will reportedly shoot a cameo for Aamir Khan's upcoming film 'Laal Singh Chaddha'. ""Salman's track revisits Prem from the Maine Pyar Kiya days and he has allotted...one day to Aamir to shoot for his cameo in the film,"" reports stated. Shah Rukh Khan also shot a cameo for the comedy-drama film in Delhi in October, as per reports."
6,"Hindu temple vandalised, set on fire by mob of hundreds in Pakistan","A Hindu temple in Pakistan's Khyber Pakhtunkhwa province was vandalised and set on fire by a mob of hundreds on Wednesday following a dispute over the land occupied by it. Khyber Pakhtunkhwa CM Mahmood Khan termed the attack as ""an unfortunate incident."" ""Legal action will be taken against all the people who took the law in their hands,"" police said."
6,Ex-PM Nawaz Sharif's passport to be cancelled on Feb 16: Pak Minister,"Pakistan's Interior Minister Sheikh Rashid Ahmed said the government will cancel ex-PM Nawaz Sharif's passport on February 16. Sharif has been in London since November last year after he was granted permission to go abroad for four weeks for medical treatment. Sharif, who was convicted in two corruption cases, was recently declared a proclaimed offender by Islamabad High Court."
5,OnePlus Co-founder Carl Pei raises $7 mn for new unannounced startup,"OnePlus Co-founder Carl Pei, who resigned from the company in October, has raised $7 million in seed funding for his new startup. High-profile investors including iPod inventor Tony Fadell, YouTuber Casey Neistat and Reddit CEO Steve Huffman funded the round. Pei didn't reveal his new venture, but said the capital will be used to set up an office in London."
1,"Talent is a vague word, every actor says 'I'm talented': Nawazuddin","During a recent interview, actor Nawazuddin Siddiqui said 'talent' has become a vague word and noted that these days every actor claims to be talented. ""If you keep working hard on your craft, you can polish your skills and talent. There's no such theory that an actor is talented for life, it's an ongoing process,"" he told Times Of India."
5,Twitter labels Trump's tweet accusing Democrats of trying to 'steal the election',"US President Donald Trump accused Democrats of trying to ""steal"" the election early Wednesday, saying his administration would ""never"" allow this to happen. Twitter immediately labelled the post with a warning saying, ""Some or all of the content shared in this Tweet is disputed and might be misleading about an election or other civic process."""
2,Top leaders of Haryana's BJP-JJP alliance to meet Amit Shah in Delhi,"The top leaders of Haryana's BJP-JJP alliance are set to meet Union Home Minister Amit Shah on Tuesday after farmers' protests in Haryana turned violent during 'Kisan Mahapanchayat'. All JJP legislators have also reportedly been asked to come to Delhi. Several leaders of the ruling alliance are on the verge of quitting, former Haryana CM Bhupinder Hooda had said."
2,Giving statements to media is loss to the party: Tariq Anwar on Sibal,"After Congress leader Kapil Sibal criticised the party's performance in Bihar Assembly polls, General Secretary Tariq Anwar said, ""If he is giving a statement in the media, it will only be a loss to the party."" He added, ""If the party lacks something and he wants to give a suggestion, he should meet the party high command and president."""
4,Don’t think India will recover from the loss at Adelaide: Brad Haddin,"Former Australia wicket-keeper Brad Haddin feels it won't be possible for Team India to recover from the eight-wicket loss in the first Test at Adelaide. ""I thought their only opportunity to win a Test match was the first Test at Adelaide,"" Haddin said. ""I don't think they will be able to turn it around,"" Haddin added."
3,Jeff Bezos names Blue Origin's landing ship after his mother,"Jeff Bezos on Wednesday unveiled Blue Origin's latest landing ship and revealed that it has been named after his mother, Jacklyn Bezos. ""New Glenn's first stage will come home to the Jacklyn after every flight,"" he wrote in an Instagram post. The 600-foot ship has been designed as a floating landing point for the first-stage booster of New Glenn rocket."
1,"Varun starrer 'Ekkis' is not shelved, shoot to begin in Sept: Sriram","Filmmaker Sriram Raghavan denied the speculations about his upcoming Varun Dhawan starrer film 'Ekkis' getting shelved and stated that they will start shooting for the biopic in September 2021. ""We were supposed to shoot in September this year...But...Ekkis has been pushed forward to next year. I need specific weather in September-October to shoot in battle locations,"" he explained."
5,Tesla to route India investment through Tesla Motors Amsterdam,"Elon Musk-led Tesla's investment for the Indian unit will be routed through the jurisdiction of Netherlands, as it has registered Tesla Motors Amsterdam as the parent organisation for Tesla India Motors and Energy, according to the company's incorporation documents. This would offer Tesla tax benefits related to capital gains and dividend payments, tax experts told Economic Times."
1,Choreographer Punit Pathak ties the knot with Nidhi Moony Singh,"Choreographer-actor Punit J Pathak tied the knot with his long-time girlfriend Nidhi Moony Singh in Lonavala on Friday. The wedding was attended by their family members and friends, including Bharti Singh, Haarsh Limbachiyaa and Yashaswini Dayama. Sharing the videos from their wedding on Instagram, Bharti wrote, ""Congratulations my favourite couple #happylife #married."""
6,"$500,000 reward announced for info on suspicious death of Indian-Fijian nurse","The Government of New South Wales has announced a $500,000 reward for information over the 2014 suspicious death of a 39-year-old Indian-Fijian nurse in Sydney's south-west. Monika Chetty was found alive in bushland in January 2014, five to ten days after she had been doused in acid. Despite medical treatment, she passed away in hospital on January 31, 2014."
4,Ravichandran Ashwin dismisses David Warner for 10th time in Tests,"Spinner Ravichandran Ashwin on Saturday dismissed Australia batsman David Warner for the 10th time in Test cricket. It is the most Ashwin has dismissed any batsman in the longest format of the game. As for Warner, England's Stuart Broad is now the only bowler who has dismissed him on more occasions than Ashwin. Broad has dismissed Warner 12 times."
5,"Facebook to face antitrust suit over WhatsApp, Instagram deals in US: Report","Facebook could face its first antitrust lawsuit in the US over its acquisition of WhatsApp and Instagram, The Guardian reported. The Federal Trade Commission (FTC) is probing whether Facebook abused its market power and acquired the apps before they could become a competition. Facebook bought Instagram for $1 billion in 2012 and WhatsApp for $19 billion in 2014."
2,Rahul doesn't know if potatoes grow above or below ground: BJP leader,"Taking a jibe at Congress for extending its support to the farmers' agitation, Madhya Pradesh BJP leader Narottam Mishra said, ""Rahul Gandhi, who drove 'sofa-cum-tractor', does not even know if potatoes grow above or below the ground."" Mishra added, ""Congress leader Kamal Nath ji, who never visited farms of a farmer in 15 months, will ride a tractor."""
0,"Fiat Chrysler, PSA merge to create Stellantis, world's 4th largest automaker","Fiat Chrysler (FCA) and Peugeot owner PSA Group have sealed their $52 billion merger to create Stellantis, the world's fourth largest automaker. The merged entity will have annual sales of around 8.1 million vehicles. Stellantis can cut annual costs by around $6.1 billion without plant closures, a statement said. FCA and PSA first announced plans to merge in October 2019."
2,Samajwadi Janata Party (Rashtriya) President Kamal Morarka dies at 74,"Former Union Minister and Samajwadi Janata Party (Rashtriya) President Kamal Morarka passed away at the age of 74 on Friday evening following a brief illness. Morarka had also served as vice-president of the Board of Control for Cricket in India (BCCI). Rajasthan MLA Rajkumar Sharma condoled his demise, tweeting, ""This is an irreparable loss to all of us."""
0,Mahindra & Mahindra cuts over half of its North America workforce: Reports,"Mahindra & Mahindra has reportedly cut over half of the workforce at its North American unit, which had over 500 employees in early 2020. Affected positions include engineers and manufacturing jobs at its Detroit plant that produces Roxor, as well as sales executives. Mahindra cited COVID-19 and a legal battle with Fiat Chrysler over an earlier Roxor model for layoffs."
4,Doesn't feel like we're out of the tournament: CSK's Gaikwad,"After CSK defeated KKR on Thursday, batsman Ruturaj Gaikwad said that the atmosphere in their dressing room is ""pretty relaxed"" and it doesn't feel that they are out of the tournament. ""Hopefully, we finish the tournament with a win and continue the momentum next year,"" he added. With 10 points from 13 matches, CSK are out of the playoffs race."
6,"WHO chief in quarantine, says 'identified as contact of COVID-19 +ve person'","World Health Organization Director-General Tedros Adhanom Ghebreyesus has tweeted, ""I have been identified as a contact of someone who has tested positive for COVID-19."" ""I am well and without symptoms but will self-quarantine over the coming days...and work from home,"" he added. ""This is how we will break chains of COVID-19 transmission,"" he further said."
0,"Apple, Hyundai to sign EV deal by March, start production by 2024: Report","Apple and Hyundai Motor plan to sign a partnership deal on autonomous electric vehicles (EVs) by March and start production as soon as 2024 in US, Korea IT News reported. The companies also plan to introduce a ""beta version"" of Apple cars next year, the report added. Earlier, Hyundai confirmed it was in talks with Apple, before retracting the statement."
2,We will never forget cowardly attack on Parliament in 2001: PM Modi,"PM Narendra Modi on Sunday said the country will never forget the ""cowardly attack on our Parliament"" in 2001 and paid tributes to security personnel who sacrificed their lives in the attack. The Parliament was adjourned at the time of the attack, but several parliamentarians and staff were present inside the building. All five terrorists were killed outside the building."
3,ISRO chief K Sivan's tenure extended by one year,"The Centre on Wednesday extended the services of ISRO chief K Sivan as Space Secretary and Space Commission Chairman by a year. Sivan was provided the extension since the space programme's flagship projects, Gaganyaan and Chandrayaan-3, are still pending. His tenure will now be up to January 14, 2022, or until further orders, whichever is earlier."
4,Natarajan would add variety as a left-arm pacer: Gilchrist,"Ex-Australia wicket-keeper Adam Gilchrist feels Natarajan should get the nod over Navdeep Saini for the Sydney Test since ""he would add variety as a left-arm pacer"" to the bowling line-up.""[Natarajan] would also leave some handy footmarks for Ravichandran Ashwin to exploit,"" Gilchrist added. Natarajan was added to the Test squad after pacer Umesh Yadav injured himself during the second Test."
4,"Expecting India to come out firing, not have any scars from Adelaide: Lyon","Ahead of the Boxing Day Test, Australia off-spinner Nathan Lyon feels India will ""come out firing and not have any scars"" from the first Test, when they were dismissed for 36. ""I don't think it will be that difficult. You look at the quality of players in the Indian side...Cricket's a new day, new game every time,"" Lyon said."
5,Will vigorously defend TikTok ban order: US,"The US Commerce Department on Sunday said it will comply with a US judge's ruling to stay a ban on TikTok in the country but will also ""vigorously defend"" its executive order. The judge on Friday had ruled that the government's threats about TikTok ""are phrased in the hypothetical"". TikTok US' deal with Oracle and Walmart is still in negotiations."
5,"After self-driving unit, Uber sells off air taxi business Elevate","Uber's air taxi enterprise, Uber Elevate has been acquired by Toyota Motor-backed Joby Aviation. Uber will invest $75 million in Joby as part of the deal and will also allow it to use Uber's app to offer air taxi rides when the company starts offering services. The deal comes days after Uber sold off its self-driving unit to Aurora."
2,Free to join any party: Rajini Makkal Mandram as some members move to DMK,"Rajini Makkal Mandram (RMM) has announced that its members are free to join any other political party of their choice after tendering a resignation. The statement came after three district secretaries of the party joined Dravida Munnetra Kazhagam (DMK) on Sunday. ""They shouldn't forget they are always Rajinikanth fans even if they join other parties,"" RMM leader VM Sudhakar said."
3,153-yr-old Patna Met Centre gets centennial observing station status,"The WMO has awarded the status of 'centennial observing station' to the Patna meteorological observatory. ""With this recognition, Patna has joined a niche club of cities having a long-term record of scientific observation in the field of meteorology, climatology and applied science,"" Centre's Director Vivek Sinha said. Patna meteorological observatory was established in 1867."
3,Russia plans to deploy its own space station after 2024,"Russia may deploy its own service orbital station, manned by two-four cosmonauts, after 2024, deputy head of Rocket and Space Corporation Energia, Vladimir Solovyov was quoted as saying by the Scientific Russia website. He added that Russia should consider revising the terms of its participation in the ISS. Russia's Roscosmos has said it's open to extending its participation beyond 2024."
5,Before and after pics show collapse of world's 2nd largest radio telescope,Space tech company Maxar has shared before and after satellite images of the world's second-largest single-dish radio telescope at the Arecibo Observatory in Puerto Rico which collapsed recently. It had suffered damages due to tropical winds in August following which one of the suspension cables snapped last month. A decision to dismantle the structure had been taken before it collapsed.
4,"Warner's wife jokingly suggests sex reason behind his injury, says 'Sorry Australia'","During a radio show, Australia batsman David Warner's wife Candice jokingly suggested that sex was the reason behind David Warner's groin injury which he sustained in the second ODI against India. ""We only sort of reunited after four months apart...and everyone's like, 'What have you done to him?''' she said. She further said, ""Sorry, Australia!"""
1,Rejected Prem Qaidi as I was supposed to be introduced in bikini: Ayesha Jhulka,"Ayesha Jhulka, who starred in films like 'Jo Jeeta Wohi Sikandar' and 'Chachi 420', spoke about the films she rejected and said, ""There was a Rama Naidu film, 'Prem Qaidi' which I'd to reject because I was supposed to be introduced in...bikini."" She further said she also couldn't do Mani Ratnam's 'Roja' due to date issues, adding, ""I regretted it."""
1,It always disturbs me when people call me legend: Samuel L Jackson,"Samuel L Jackson, who was recently honoured with Legend of Cinema Award at SCAD Savannah Film Festival, has said being called a legend ""disturbs"" him. ""Legends are people who accomplish things that can't be accomplished by other people, or did something that's super extraordinary,"" he said, adding, ""I just persevered through hard work and doggedness to get where I am."""
6,Men remove metal monolith from US mountain and replace it with cross,"A metal monolith that appeared atop a mountain in the US state of California has been removed by a group of men. A video of the men surfaced online, in which they can be heard chanting ""America First"" and ""Christ is King"". The group replaced the metal monolith with a wooden cross."
2,Senior Raj leader Ghanshyam Tiwari returns to BJP 2 years after quitting,"Senior Rajasthan leader Ghanshyam Tiwari returned to BJP on Saturday, two years after he quit the party over differences with former CM Vasundhara Raje. Tiwari, who had floated his own outfit Bharat Vahini Party before 2018 Assembly elections, was seen sharing the stage at a rally with Rajasthan CM Ashok Gehlot and Congress leader Rahul Gandhi before 2019 general elections."
1,"After row on Taimur's name, we've not thought about it: Kareena on 2nd baby name","During the latest episode of talk show 'What Women Want', Kareena Kapoor spoke about naming her second child and revealed that she and her husband Saif Ali Khan have not thought about it yet. She said, ""After the whole name controversy of Taimur, both Saif and me haven't...thought about it. We're...going to leave it last minute and then...spring a surprise."""
5,Will spare no effort in providing level-playing field in e-comm: Govt,"Union Minister Som Parkash assured the government will not spare any efforts in maintaining a level-playing field in e-commerce. He also added that violation of government policies ""will not be tolerated any more"". He was speaking at the event to launch the logo of the upcoming e-commerce portal 'BharatEMarket' of the traders' body CAIT."
5,France asks Twitter to suspend Ex-Malaysian PM Mahathir's account,"France's Secretary for Digital Sector Cédric O has asked Twitter to suspend former Malaysian PM Mahathir Mohamad's account following his tweets justifying a knife attack in Nice. ""If not, Twitter would be an accomplice to a formal call for murder,"" he added. 





Mahathir on Thursday had tweeted that ""Muslims have right to be angry & kill millions of French people""."
5,India's most affordable 5G smartphone moto g 5G launched: Motorola,"Motorola launched their latest 5G phone, moto g 5G that offers India's first ultra-fast Qualcomm®️ Snapdragon™ 750G 5G processor with 6GB RAM, the company mentioned, adding that at ₹20,999, it's India's most affordable 5G smartphone. It comes with 6.7"" HDR10 display, 48MP Triple Camera System, 5000mAh Battery, Stock Android™ Experience & more. Sale starts on December 7, exclusively on Flipkart."
1,"Cueist Pankaj Advani marries celebrity makeup artist Saniya Shadadpuri, shares pics","Indian cueist Pankaj Advani tied the knot with celebrity makeup artist and hairstylist Saniya Shadadpuri in an intimate ceremony with family and close friends in Mumbai on Wednesday. He took to Instagram to share pictures from the ceremony and wrote, ""January 6, 2021...The birthdate of our union...A celebration of a new journey we take together."""
4,It's time to hand this team over to the next generation: CSK captain MS Dhoni,"Following their last match of IPL 2020, CSK captain MS Dhoni said, ""It's time to hand the team over to the next generation."" He added, ""We need to slightly change our core group and look for next 10 years."" Dhoni further said, ""We will come back strong. That's what we are known for."" CSK won six matches in IPL 2020."
4,Manchester United exit Champions League after loss against RB Leipzig,"A 3-2 loss to RB Leipzig in the Group H encounter on Tuesday knocked Manchester United out of the Champions League. Due to the loss, United finished third in Group H with nine points from six matches while Leipzig and PSG progressed to Round of 16. United needed at least a draw against Leipzig to progress to the knockout stages."
1,"Felt like throwing Sushant out of house after argument, later he said sorry: Nitish","Actor Nitish Bharadwaj, while recalling working with Sushant Singh Rajput in 'Kedarnath', revealed they once had an altercation during rehearsal and he ""felt like throwing Sushant out of the house"". ""Eventually, we gave the shot and...he came and hugged me [and] he was like 'Sorry sir',"" Nitish added. ""These are all creative altercations...Later he had sent me chocolates,"" said Nitish."
2,"Cong MLCs manhandle, remove K'taka Legislative Council Dy Chairman","Congress MLCs on Tuesday manhandled and forcefully removed Deputy Chairman SL Dharmegowda from the chair in Karnataka Legislative Council. Congress MLC Prakash Rathod said BJP and JD(S) made him sit illegally when the House was not in order and therefore they evicted him. BJP MLC Lehar Singh Siroya said, ""We've never seen such a shameful day in our Council's history."""
6,US attorney’s office is investigating my tax affairs: Hunter Biden,"US President-elect Joe Biden's son Hunter Biden on Wednesday said US attorney's office in Delaware is investigating his ""tax affairs"". Hunter said he took the case ""very seriously"" but was confident an ""objective review"" would demonstrate that he handled his affairs ""legally and appropriately"". Biden's transition team in a statement said that the president-elect was ""deeply proud of his son""."
1,Working with the cast of 'Tandav' was absolutely brilliant: Kritika,"Actress Kritika Kamra, while sharing her experience of working with the cast of 'Tandav', said, ""It was absolutely brilliant and I must add they're so well cast."" She added, ""There were a lot of people I knew, and some, of course, I got to know through...project."" The show stars Saif Ali Khan, Dimple Kapadia and Mohammed Zeeshan Ayyub, among others."
6,Pakistan's coronavirus cases exceed 4 lakh-mark,"Pakistan's total COVID-19 cases on Tuesday rose to 4,00,482 after 2,458 new cases were reported in the past 24 hours, the country's Health Ministry said. The total COVID-19 death toll increased to 8,091 with 66 new deaths being reported during the same period, it added. Pakistan is currently dealing with the second wave of COVID-19 infections."
5,Elon Musk's girlfriend Grimes says she 'finally' has COVID-19,"Tesla CEO and world's richest person Elon Musk's girlfriend, Grimes, posted an Instagram story over the weekend where she said she ""finally"" has COVID-19. ""Finally got COVID-19 but weirdly enjoying the DayQuil fever dream 2021,"" she wrote. The 32-year-old singer, who shares baby boy X Æ A-Xii with Musk, also shared the song 'Good Days' in her story about COVID-19."
5,Pokèmon Go creator Niantic acquires US online gaming startup Mayhem,"Pokémon Go creator Niantic announced the acquisition of Mayhem, a San Francisco-based startup focused on online gaming communities. The terms of the acquisition were not disclosed by Niantic. The ""majority"" of Mayhem's team will be joining Niantic. Its CEO Ivan Zhou will join Niantic's Social Platform Product team, while the rest of the team will join Platform Engineering."
1,Passion is the only thing which stands the test of COVID-19: Sara,"Actress Sara Ali Khan, who is currently shooting for her upcoming film 'Atrangi Re' alongside Akshay Kumar and Dhanush, said the cast and crew of the film worked together amid the pandemic because of their passion for filmmaking. ""Passion...is the only thing which stands the test of COVID-19...We make movies to have fun,"" she added."
1,"Alcohol found in actress Arya Banerjee's stomach, death not a case of homicide","The post-mortem report of 'The Dirty Picture' actress Arya Banerjee has confirmed that her death was not a case of homicide. Kolkata Police Joint Commissioner (crime) Murli Dhar Sharma said she was suffering from cirrhosis of liver. ""It was not a case of homicide. Alcohol was found in her stomach at the time of her death,"" he stated."
3,"China's Mars probe travels 400M km in 163 days, to enter Mars' orbit in Feb","China's first Mars exploration mission Tianwen-1 travelled more than 400 million kilometres by January 3 and is expected to enter Mars' orbit next month, China's space agency said. It was about 130 million kilometres from Earth and about 8.3 million kilometres from Mars. After entering Mars' orbit, it will spend two-three months surveying potential landing sites."
6,Trump supporters protest in support of his election fraud claims,"US President Donald Trump's supporters on Saturday protested across the country against his loss in the presidential election. The protesters have supported Trump's allegations that there was voter fraud in the election. Violence was reported at some of the rallies with one being shot and four others being stabbed, according to AFP."
4,"Drunk supporters racially abuse Bumrah, Siraj, call them 'monkey'; complaint lodged","Team India management has lodged a complaint with the match officials after pacers Jasprit Bumrah and Mohammed Siraj were racially abused by ""drunk supporters"" at Sydney Cricket Ground. As per journalist Boria Majumdar, the two cricketers were called 'monkey' by the supporters. ICC officials and stadium security officers had long discussions with Team India management after stumps on day three."
4,Amir's retirement will have negative impact on Pakistan cricket: Inzamam,"Talking about Pakistani pacer Mohammad Amir's retirement aged 28, ex-Pakistan captain Inzamam-ul-Haq said that what bothers him about the decision is not what impact it'll have on Pakistan bowling resources but the negative impact it'll have on Pakistan cricket and its image. ""It is better if such situations don't take place,"" he added. Amir had said, ""PCB ruined his image."""
4,"Umpire doesn't declare head-high delivery as no-ball in RCB-SRH match, criticised","RCB fast bowler Isuru Udana bowled a head-high delivery against SRH's Kane Williamson, which umpire failed to declare as no-ball. Several cricketers criticised the decision with Jimmy Neesham tweeting, ""No balls are head high now???"" Meanwhile, Yuvraj Singh tweeted, ""I honestly can’t believe that was not given a no ball ! Like seriously!!!"" ""Wakey wakey,"" wrote Mitchell McClenaghan."
