6,"1,000 vehicles stuck in 16-km-long traffic jam after snow storm in Japan","More than 1,000 vehicles in Japan were stranded in a traffic jam that stretched up to 16 kilometres. The jam began after a car got stuck in deep snow in the middle of a highway, said NEXCO, Japan's highway operator. Self-Defense Force troops were delivering food, petrol and blankets, while fire service crews rescued some drivers, public broadcaster NHK said."
1,A silly day to remember in sadness: Walker's daughter on his death anniversary,"Hollywood actor Paul Walker's daughter Meadow Walker took to Instagram to share an old picture of herself with her late father on his seventh death anniversary. She wrote, ""A silly day to remember in sadness."" Meadow added, ""Today's a celebration of the love and happiness you brought to the world. Here's a photo of my best bud & I napping."""
5,Will look into inaction against Bajrang Dal if referred: FB Oversight Board,"Facebook's Oversight Board will investigate why the platform took no action against the right-wing nationalist group Bajrang Dal if the matter is referred to the panel, the board's Indian representative Sudhir Krishnaswamy told ET. The WSJ earlier reported that Facebook did not ban Bajrang Dal after its security team warned that the move could endanger Facebook's business and its employees."
1,Wajid Khan's wife reveals she was harassed by his family to convert to Islam,"Late music composer Wajid Khan's wife Kamalrukh Khan has alleged she was harassed by Wajid's family to convert to Islam. ""My dignity...didn't permit me to bend backwards for him and his family, by converting to Islam,"" she wrote. ""The result-being outcast from my husband's family, scare tactics to make me convert included taking me to court seeking divorce,"" added Kamalrukh."
5,Telegram's People Nearby can reveal users' exact location: Report,A cybersecurity blog Ahmed's Notes pointed out that Telegram’s People Nearby feature can be exploited to know the exact location of users. The feature lets users send messages to other Telegram users nearby. The blog revealed that one can spoof their location for three points and use them to draw three triangulation circles to know the exact location of users.
2,35.8% voter turnout recorded till 5 pm in GHMC polls: T'gana EC,The Telangana State Election Commission has said that 35.8% of over 74 lakh voters voted till 5 pm in the Greater Hyderabad Municipal Corporation (GHMC) polls on Tuesday. The commission further said that the voter turnout was expected to touch 40%. The COVID-19 positive electors had been asked to cast their votes between 5 pm and 6 pm.
1,"Singer Jazzy B arrives at Singhu border, extends support to farmers","Indian-Canadian singer Jazzy B on Tuesday reached Singhu border to extend his support to farmers who are protesting against the farm laws. ""These farmers' dharnas are having an impact abroad as well,"" Jazzy B said. He added that the protesting farmers, especially the youth, should not do anything wrong that ""would bring disrepute to the peasant movement""."
1,I like women's bodies but not their brains: Filmmaker Ram Gopal Varma,"On being asked about his statement to actress Suchitra Krishnamoorthi when he had said 'I like women's bodies but not their brains', filmmaker Ram Gopal Varma commented that he still maintains his stance. ""Brain does not have a gender...sexual aspect is very...specific,"" he added. ""A woman has an extra thing which is her sensuality...which I admire,"" Varma further said."
5,Robots created in-house deployed by Central Railway to combat COVID-19,"Central Railway is using robots and robotic devices designed and created in-house for the thermal screening of passengers, helping the frontline staff in dealing with passengers and treating coronavirus cases. The robots are called Febri Eye and Captain Arjun. A mobile app called CheckIn Master with OCR and QR code scanning facility was also launched to help ticket checking personnel."
4,Keeping Smith out from captaincy due to sandpaper incident not understandable: Vaughan,"Former England captain Michael Vaughan has said that keeping Steve Smith out of the Australia captaincy role due to the sandpaper scandal is not understandable. ""Australia are overthinking it...they are looking at what happened a few years ago...everyone has moved on from the ball-tampering incident...If there is an opportunity in ODIs or Tests, then Smith [should captain] Australia,"" he added."
3,10 costliest disasters of 2020 caused $150B worth of damages: Report,"The ten costliest weather disasters this year worldwide caused insured damages worth over $150 billion, NGO Christian Aid reported. They claimed at least 3,500 lives and displaced more than 13.5 million people. Five of the most costly extreme weather events were related to Asia's unusually rainy monsoon. Only 4% of economic losses from climate-impacted events in low-income countries were insured."
2,Chandrababu Naidu burns Andhra govt orders on farmers in Bhogi bonfire,"TDP President N Chandrababu Naidu on Wednesday burnt Andhra Pradesh government orders in Bhogi bonfire. The orders were related to fixing meters to pump set motors, zero-interest loans scheme and selection of farmers on basis of caste for welfare schemes, the ANI reported. Bhogi is part of the Pongal festival in which useless household articles are put in the bonfire."
5,"Airbnb bans hate group members, US Capitol siege attendees from platform","Airbnb announced that it is banning members who have been cited by the media or law enforcement as Capitol siege attendees. It added that guests associated with hate groups or those who partake in ""violent criminal activity"" will also be banned. The platform will also refer to the arrest logs of the DC Metro Police from the Capitol violence day."
0,Tesla to raise $5 billion as market cap crosses $600 billion,"Elon Musk-led Tesla on Tuesday announced that it will be raising $5 billion, marking its second capital raise in the last three months. The additional shares will be sold ""from time to time"" and ""at-the-market"" prices. Its shares are up nearly 670% this year with its market capitalisation crossing $600 billion. Tesla will join S&P 500 index later this month."
4,Shane Warne picks his Australia XI for the pink ball Test vs India,"Ex-Australia leg-spinner Shane Warne has picked his country's playing XI for the first Test match against India. Warne picked Matthew Wade and Marcus Harris as openers with Marnus Labuschagne, Steve Smith and Travis Head at number three, four and five respectively. Warne included Cameron Green and picked Mitchell Starc, Pat Cummins, Josh Hazlewood, and Nathan Lyon as the bowling unit."
3,Chinese spacecraft brings 1st lunar samples in over 40 years,"China's Chang'e-5 probe successfully landed in the northern Chinese region, bringing back the first lunar rocks and soil retrieved by any country in over 40 years. China is now the third country to have retrieved lunar samples. It will be sharing a portion of the lunar soil with other nations and organisations based on international cooperation conventions."
0,Indians seek value for money even in luxury products: Mercedes-Benz India CEO,"Mercedes-Benz India CEO Martin Schwenk said Indians ""look for value for money and that's even in a high-end product."" He also remarked that usage in India is also different compared to other markets as many consumers here prefer the car to be chauffeur-driven. He said balancing between making car equally chauffeur and owner-friendly makes India ""a slightly more difficult market""."
6,India asks UN members to condemn attacks on all religions,"India on Wednesday called out UN member states for selective condemnation of attacks on Abrahamic religions, leaving religions like Hinduism, Buddhism and Sikhism. ""As long as such selectivity exists, the world can never truly foster a culture of peace,"" Indian diplomat Ashish Sharma said at UNGA. He called on the UN Alliance of Civilizations to speak for all."
6,US friends buying groceries offered COVID-19 vaccines as they were set to expire,"Two friends in the US who were buying groceries at a supermarket received Moderna's COVID-19 vaccine. A pharmacist approached them to ask if they were interested in getting the vaccine and told them that many first responders missed their vaccine appointments. As the vaccines couldn't be kept at room temperature beyond a few hours, they would have to be discarded."
6,"2 people suffer side effects of Pfizer COVID-19 vaccine in UK, warning issued","UK regulators have issued a warning that people who have a history of significant allergic reactions should not currently receive the Pfizer/BioNTech COVID-19 vaccine. This comes after two NHS staff members who had the jab on Tuesday showed allergic reactions to the vaccine. The UK began vaccinating care home and hospital patients and NHS staff, among others from Tuesday."
0,Tesla teams to visit Indonesia to discuss investment in EV components,"Tesla will send delegations to Indonesia next month to discuss potential investment in a supply chain for its electric vehicles. Government officials and Tesla CEO Elon Musk have discussed investment opportunities in Indonesia over a call. Indonesia earlier pointed out it has the ""biggest"" nickel reserves. Musk plans to offer a ""giant contract for a long period of time""."
6,Trump says it's 'terrific' 15% Americans got COVID-19 as 'it's powerful vaccine',"US President Donald Trump said it's ""terrific"" that nearly 15% of Americans contracted coronavirus since the outbreak began in the US, describing infections as a ""very powerful vaccine in itself"" while apparently referring to herd immunity. The US President further told reporters at a White House coronavirus vaccine event on Tuesday that ""the vaccine was our goal""."
3,Netherlands kills 1.9L chickens over 'highly-contagious bird flu strain',"Dutch authorities have culled around 1.9 lakh chickens after a bird flu outbreak on at least two poultry farms. In both the cases ""a highly-contagious strain of the H5 variant"" was suspected, the agriculture ministry said. There were no other poultry farms within a one-kilometre radius of the outbreaks."
6,Trump helped Mexico get COVID-19 vaccine: President Obrador,"Mexico's President Andrés Manuel López Obrador has said that US President Donald Trump and Vice President Mike Pence helped the country get COVID-19 vaccine. Mexico, on Wednesday, signed a deal with American drugmaker Pfizer to acquire 34.4 million doses of its COVID-19 vaccine. Obrador said that Mexico will distribute the vaccine only after US regulators approve it."
4,"KL Rahul jokes around with Finch after he gets hit on stomach, video viral","Team India wicketkeeper-batsman KL Rahul joked around with Australia captain Aaron Finch after the latter was hit on the stomach by a full-toss delivery by fast bowler Navdeep Saini. In a video that has gone viral, Rahul can be seen checking on Finch by touching his stomach. ""This series is too friendly,"" a commentator was heard saying."
5,Indian tech firms received $38B during COVID-19: Amitabh Kant,"NITI Aayog CEO Amitabh Kant said that Indian tech companies have witnessed over $38 billion investment in the last five to six months while the world was reeling under the impact of COVID-19. While speaking at the TiE Global Summit, he added that India is currently home to 34 unicorn startups and 52 soonicorns (soon to be unicorns)."
3,4 volunteers who got Pfizer vaccine developed temporary facial paralysis: US FDA,"Four trial participants who received the Pfizer and BioNTech's coronavirus vaccine developed Bell's palsy, a form of temporary facial paralysis, according to the US' Food and Drug Administration (FDA). No members of the placebo group experienced similar adverse effects. There were no ""meaningful imbalances"" in serious health complications between the two groups, the FDA said in a report."
6,US is bullying: China after Trump bans eight Chinese apps,"China on Wednesday accused the US of ""bullying"" after US President Donald Trump signed an executive order banning transactions with eight Chinese apps, including Alipay and WeChat Pay. China said that the US is abusing its national power and was unreasonably suppressing foreign companies. China added that it would take necessary steps to safeguard the legitimate rights of its companies."
2,Can't even call him a misled youth: MP Home Min on Akhilesh's vaccine remark,"After Samajwadi Party chief Akhilesh Yadav's remark on COVID-19 vaccine, Madhya Pradesh Home Minister Narottam Mishra said he can't even be called a misled youth. ""When he never listened to his uncle or father, why would he listen to the country? This is a policy of appeasement,"" Mishra added. ""The inoculation programme under BJP regime can't be trusted,"" Yadav said."
4,"F1 car bursts into flames during practice session, driver helps put out fire himself","Alfa Romeo driver Kimi Raikkonen's car burst into flames during the second practice session in Abu Dhabi on Friday. As Kimi parked up, his engineer was heard saying, ""You've a big fire, get the hell out of there quick."" Later, he was seen instructing marshals where to spray to put out the fire before taking hold of an extinguisher himself."
6,China's Sinopharm says its COVID-19 vaccine has 79% efficacy,"China's Sinopharm has said that its vaccine was found to be 79.34% effective at protecting people against COVID-19 in the Phase 3 trials. The company added that it has sought regulatory approval for general public use in China. Earlier this month, UAE approved Sinopharm's vaccine and said it was 86% effective, based on interim analysis of Phase 3 clinical trials."
1,Feels great: Vidya on short film 'Natkhat' reaching Oscar 2021 race,"Speaking about her short film 'Natkhat' entering the race for the Academy Awards 2021's Best Short Film (Live Action) category, actress Vidya Balan said, ""It feels great to have our film qualify for the Oscars."" The actress who starred in the film and co-produced it, said, ""This film is incredibly close to me."""
6,"Snowstorm causes 134-car pile-up in Japan, 1 dead","A snowstorm has caused a 134-car pile-up on a highway in Japan's Miyagi prefecture, leaving one dead and injuring 17 others. Some 200 people were caught up in the crashes and rescuers are currently at the scene, officials said. The Japan Meteorological Agency registered a maximum wind speed of around 100 kilometres per hour at the time of the incident."
2,Won't be surprised if Tejashwi becomes Bihar CM: Shiv Sena MP Raut,"Shiv Sena leader Sanjay Raut on Saturday said that he won't be surprised if Tejashwi Yadav goes on to become the Chief Minister of Bihar after the assembly elections. Raut said, ""A young man without any support, whose family members are in jail and CBI and IT Department is behind him, is challenging everyone in a state like Bihar."""
5,Instagram 'Live Rooms' to let 4 users stream simultaneously in India,"Instagram on Tuesday said it has rolled out its 'Live Rooms' feature in India, which enables users to go live with up to three additional people. Earlier, users could go live with only one additional person. India is one of the first countries to roll it out broadly and the feature will be available to everyone soon, Instagram said."
3,'Magic' mushrooms grow in US man's blood after he injects it in form of tea,"A 30-year-old US man was hospitalised with organ failure after he injected himself with a tea made from psychedelic mushrooms, which later started growing in his veins. A case report said his liver was damaged and his kidneys weren't functioning properly. Doctors said he had tried to use the so-called ""magic"" mushrooms as an alternative treatment for his bipolar disorder."
0,Workers of Toyota unit near B'luru to continue strike over workload,"Factory workers at Toyota Kirloskar Private Limited's Bidadi unit, located near Bengaluru, announced that they will continue their ongoing strike over increased workload, among other concerns. They said that they don't get time to drink water or use the washroom. The unit has been in a lockout since November 10, after 41 workers were suspended for allegedly questioning the management."
6,Trump leaves office with lowest approval rating of his presidency at 34%,"US President Donald Trump's approval rating dropped to 34%, the lowest rating of his presidency, according to a Gallup poll. The survey showed that Trump's rating had fallen 12 percentage points since before the November 3 presidential election. Trump's average approval rating across his term is 41%, four points lower than any of his predecessors since Gallup began gathering data."
2,Not a protest site: Javadekar after Rahul walks out of Standing Committee,"Union Minister and BJP leader Prakash Javadekar said that Congress' Rahul Gandhi attended two of the 14 meetings of Parliamentary Standing Committee on Defence in one and a half years. ""He's himself absent and then blames govt...Standing Committee isn't a protest site,"" Javadekar added. This comes after Gandhi and Congress members walked out of Defence Parliamentary Panel meeting."
5,"Facebook says some users facing issues with Messenger, Instagram","Facebook said on Thursday some users were facing issues while sending messages on Messenger, Instagram and its office collaboration service Workplace. ""We're working to get things back to normal as quickly as possible,"" a Facebook spokesperson said. According to Downdetector, more than 1,800 people reported issues with Messenger, whereas 350 people reported issues with Instagram."
5,Samsung uses iPhone to tweet about its upcoming smartphone; gets trolled,"Samsung used its rival company Apple's iPhone to promote an event for the upcoming Galaxy S21 smartphone. A poll posted by the official Twitter handle of Samsung Mobile US had 'Twitter for iPhone' written at the bottom, implying that an iPhone was used to post the tweet. ""Not even Samsung employees use a Samsung phone,"" a Twitter user said."
1,I want my films to reach as many people as possible: Kiara Advani,"Commenting on her film 'Laxmii' releasing on a digital platform instead of movie theatres due to the coronavirus pandemic, Kiara Advani said, ""As an actor, I just want my films to reach as many people as possible."" Stating that the film was made for a theatrical release, the actress said, ""We'll miss the community watching aspect."""
4,F***ing consistency: Tim Paine heard saying on stump mic over umpire's decision,"Australia captain Tim Paine was heard saying 'F***ing consistency, Blocker' to on-field umpire Paul Wilson after a failed review against India's Cheteshwar Pujara. Third-umpire Bruce Oxenford asked Wilson to stay with his decision after evidence from replays couldn't conclude whether Pujara's bat had touched the ball. ""I'm not the third umpire,"" Wilson was heard telling Paine."
3,Dinosaur fossil found in Brazil reveals new chicken-sized species,"Paleontologists have discovered a chicken-sized dinosaur species with a mane of hair down its back and stiff ribbon-like structures projecting from its shoulders. The dinosaur, Ubirajara jubatus, is believed to have lived around 110 million years ago in northeastern Brazil. ""There are...strange dinosaurs, but this one is unlike any of them,"" said professor David Martill, who helped lead the study."
1,I may have imbibed a lot from Guddu: Ali on his 'Mirzapur' character,"Commenting on portraying the character of Guddu Pandit in the first and second seasons of the web series 'Mirzapur', actor Ali Fazal said, ""I may have imbibed a lot from Guddu."" He further said, ""Mirzapur season two was more interesting in terms of empathy. You realise sometimes you need to lose something to understand what it is to really lose."""
1,Marathi music director Narendra Bhide dies of cardiac arrest at 47,"Marathi music director Narendra Bhide died of a heart attack on Thursday morning at his Pune residence at the age of 47. Calling Bhide's demise an ""irreparable loss in the music field"", singer Kailash Kher tweeted, ""God should grant salvation to the departed soul."" Bhide composed music for films like 'Deool Band' (2015), 'Bioscope' (2015), 'Mulshi Pattern' (2018), among others."
5,"N95 mask with noise-cancelling earbuds, in-built mic unveiled at CES","Telecom firm Binatone unveiled its MaskFone at CES 2021, which is a mask with a standard N95 filter and has in-built earbuds for answering calls and listening to music. It has an environmental noise-cancelling feature and an in-built mic. MaskFone offers breathable fabric, water and sweat-resistance and controls for picking up calls or adjusting volume."
4,"Top 4 runners break half marathon's world record, Kenyan runner sets new record","Kenyan runner Kibiwott Kandie on Sunday smashed the half marathon's world record, clocking 57:32 at the Valencia Half Marathon. Notably, all top four men ran under the previous world best, with Jacob Kiplimo of Uganda finishing second in 57:37, Kenyan Rhonex Kipruto third in 57:49 and Kenyan Alexander Mutiso taking fourth place in 57:59. The previous world record was 58:01."
3,"IUCN lists 31 species as 'Extinct', European Bison sees recovery","The IUCN released an update of its Red List of Threatened Species which moved 31 species into the 'Extinct' category. However, the European Bison has moved from 'Vulnerable' to 'Near Threatened' category. Besides this, all of the world's freshwater dolphin species are now listed as threatened on the list. The lost shark has entered the 'Critically Endangered' (Possibly Extinct) category."
5,NITI Aayog suggests regulating online fantasy sports platforms,"NITI Aayog has released a draft paper to discuss uniform national regulation and setting operating standards for online fantasy sports platforms (OFSP) in India. The think-tank suggests OFSPs to abide by all Indian laws, offer only skill-predominant formats among several other reforms. Fantasy gaming is currently a state subject, which means rules and regulations differ from state to state."
0,Alphabet's Waymo to no longer use the term 'self-driving' for its tech,"Alphabet's subsidiary Waymo has said that it will no longer use the term ""self-driving"" to describe the technology it has been developing. The company will, instead, be opting for the term ""autonomous"". ""Waymo's vehicles don't drive themselves. Rather, Waymo is automating the task of driving and thus the term ""autonomous driving"" is more accurate,"" the company said."
0,Fiat Chrysler to invest $250 million in India unit,"Fiat Chrysler Automobiles (FCA) has said it will invest $250 million in India to launch four new sport-utility vehicles (SUVs) over the next two years, taking its total investment in the country to over $700 million. The company will produce and assemble the new SUVs at its car plant in Maharashtra, which it jointly owns with Tata Motors."
2,May God bless you with a long life: PM to Sonia on her birthday,"Prime Minister Narendra Modi on Wednesday wished Congress chief Sonia Gandhi on the occasion of her 74th birthday, tweeting, ""May God bless her with a long and healthy life."" Union Minister Nitin Gadkari also tweeted, ""Birthday greetings to the President of the Indian National Congress party Smt Sonia Gandhi Ji. May you be blessed with good health and long life."""
5,"Gujarat woman stalked, defamed after being lured into 'free innerwear' scam","A 19-year-old Gujarat woman was stalked and defamed by a person after being lured into a fake scheme offering free innerwear. She received a promotional text offering ""free innerwear"". She was asked to share a picture of herself on WhatsApp and once she shared her picture, the accused demanded nudes and threatened to upload her morphed pictures on the internet."
1,"Amala allowed to sue ex for sharing private pics, claiming they got married","The Madras High Court has allowed actress Amala Paul to file a defamation case against her ex-boyfriend Bhavninder Singh for posting their private pictures and claiming they got married in a secret marriage ceremony in March. The actress had denied getting married to the Mumbai-based singer and claimed that the photos, taken for professional work, had been misused."
4,"We had India 200/6, then Shardul, Sundar batted beautifully: Hazlewood","Talking about the third of the Brisbane Test, Australia pacer Josh Hazlewood said they thought they were on top when India lost six wickets before reaching the 200-run mark. ""Washington Sundar and Shardul Thakur batted beautifully,"" he added. Sundar and Thakur stitched a partnership of 123 runs off 217 balls, India's highest partnership for the seventh wicket at the Gabba."
2,"CPI, CPI(M) leaders protest in Hyderabad against farm laws","CPI and CPI(M) leaders, among other Left party leaders in Telangana, on Monday protested in Hyderabad against the government's three new farm laws. They held placards demanding abrogation of the three ""pro-corporate"" farm laws and boycott of certain big corporates. Senior Congress leader V Hanumantha Rao observed a fast from 10 am to 4 pm at his residence in Hyderabad."
4,"Take hands out of pockets, you're playing for India not a club: Yuvraj on Gill's pic","After Australia-India ODI series concluded, Shubman Gill took to Instagram to share pictures from the third ODI. ""Great feeling representing my country,"" he wrote. Reacting to a picture wherein Gill can be seen standing on the field with his hands in pockets, Yuvraj jokingly wrote, ""Take your hands out of pockets, you're playing for India not a club."""
